{
  "$schema": "../../schemas/adapter.schema.json",
  "id": "trae",
  "version": "0.1.1",
  "status": "planned",
  "capabilities": {
    "rules": "manual-guide",
    "skills": "unverified",
    "commands": "unverified",
    "mcp": "unverified",
    "hooks": "unverified"
  },
  "outputs": {
    "guides": "adapters/trae/guides"
  }
}
