{
  "$schema": "../../schemas/adapter.schema.json",
  "id": "qoder",
  "version": "0.1.5",
  "status": "planned",
  "capabilities": {
    "rules": "legacy-template",
    "skills": "unverified",
    "commands": "unverified",
    "mcp": "unverified",
    "hooks": "unverified"
  },
  "outputs": {
    "templates": "adapters/qoder/templates"
  }
}
