{
  "$schema": "../../schemas/adapter.schema.json",
  "id": "codex",
  "version": "0.1.5",
  "status": "implemented",
  "capabilities": {
    "rules": "project-entry-implemented",
    "skills": "ide-user-delivery-not-implemented",
    "commands": "delivery-not-implemented",
    "mcp": "delivery-not-implemented",
    "hooks": "delivery-not-implemented"
  },
  "outputs": {
    "projectEntry": "AGENTS.md"
  }
}
